{
  "productId": "APTAR-PUMP-001",
  "name": "EcoStar Airless Pump",
  "category": "dispensing",
  "market": "beauty",
  "description": "Airless pump dispenser for skincare products, made from 100% recycled materials",
  "material": "recycled-plastic",
  "sustainable": true,
  "sku": "ECO-PUMP-50ML"
}